{
  "$schema": "http://json-schema.org/draft-07/schema#",
  "$id": "https://sboard.local/schemas/petition.schema.json",
  "title": "Petition",
  "description": "A request to the synthetic board for a board meeting on a specific question.",
  "type": "object",
  "required": [
    "petition_id",
    "submitted_at",
    "meeting_type",
    "pitch"
  ],
  "properties": {
    "petition_id": {
      "type": "string",
      "format": "uuid",
      "description": "UUID v4. Generated by the submitter."
    },
    "submitted_at": {
      "type": "string",
      "format": "date-time",
      "description": "ISO-8601 UTC timestamp."
    },
    "submitter": {
      "type": "string",
      "maxLength": 100,
      "description": "Free-form identifier for the founder. Optional in MVP."
    },
    "meeting_type": {
      "type": "string",
      "enum": ["idea_screen"],
      "description": "Which meeting protocol to run. MVP supports idea_screen only."
    },
    "pitch": {
      "type": "string",
      "minLength": 50,
      "maxLength": 5000,
      "description": "The founder's pitch. Roughly one paragraph, 50-1000 words. The board reads this as the proposed venture."
    },
    "context": {
      "type": "string",
      "maxLength": 10000,
      "description": "Optional additional context: market data, founder background, prior attempts. The board may reference this; it is not the pitch."
    },
    "attachments": {
      "type": "array",
      "items": { "type": "string" },
      "description": "URIs of attachments. Ignored in MVP."
    },
    "constraints": {
      "type": "object",
      "description": "Optional founder-set constraints on the meeting.",
      "properties": {
        "max_wall_clock_seconds": {
          "type": "integer",
          "minimum": 30,
          "maximum": 600,
          "default": 120
        },
        "max_cost_usd": {
          "type": "number",
          "minimum": 0.5,
          "maximum": 50.0,
          "default": 5.0
        }
      }
    }
  },
  "additionalProperties": false
}
